{
  "$schema": "../benchmark.schema.json",
  "id": "bench-004",
  "model": "model-name",
  "complexity": "Basic",
  "circuit": "RC filter",
  "prompt": "The exact prompt sent to the model.",
  "components": 2,
  "boardSize": "36 × 22 mm",
  "platforms": [
    {
      "name": "tscircuit",
      "pcb": "/benchmarks/bench-004/tscircuit/pcb.svg",
      "schematic": "/benchmarks/bench-004/tscircuit/schematic.svg",
      "pcbSource": "/benchmarks/bench-004/tscircuit/index.circuit.tsx",
      "schematicSource": "/benchmarks/bench-004/tscircuit/index.circuit.tsx",
      "renderer": "@tscircuit/core x.y.z"
    },
    {
      "name": "KiCad",
      "pcb": "/benchmarks/bench-004/kicad/pcb.png",
      "schematic": "/benchmarks/bench-004/kicad/schematic.svg",
      "pcbSource": "/benchmarks/bench-004/kicad/board.kicad_pcb",
      "schematicSource": "/benchmarks/bench-004/kicad/board.kicad_sch",
      "renderer": "KiCad CLI x.y.z"
    }
  ]
}
